,Survey,Variable,Description
268,Hopkins Symptom Cheklist,hopkins45,Having to check and doublecheck what you do.
269,Hopkins Symptom Cheklist,hopkins46,Difficulty making decisions.
270,Hopkins Symptom Cheklist,hopkins47,Wanting to be alone.
271,Hopkins Symptom Cheklist,hopkins48,Trouble getting your breath.
272,Hopkins Symptom Cheklist,hopkins49,Hot or cold spells.
273,Hopkins Symptom Cheklist,hopkins50,Having to avoid certain things places or activities because they frighten you.
274,Hopkins Symptom Cheklist,hopkins51,Your mind going blank.
275,Hopkins Symptom Cheklist,hopkins52,Numbness or tingling in parts of your body.
276,Hopkins Symptom Cheklist,hopkins53,A lump in your throat.
277,Hopkins Symptom Cheklist,hopkins54,Feeling hopeless about the future.
278,Hopkins Symptom Cheklist,hopkins55,Trouble concentrating.
279,Hopkins Symptom Cheklist,hopkins56,Weakness in parts of your body.
280,Hopkins Symptom Cheklist,hopkins57,Feeling tense or keyed up.
281,Hopkins Symptom Cheklist,hopkins58,Heavy feelings in your arms or legs.
